Наименование;"Наименование артикула";"Код артикула";Валюта;Цена;"Доступен для заказа";"Зачеркнутая цена";"Закупочная цена";"Краткое описание";Описание;Теги;Заголовок;"Тип товаров""META Keywords";"META Description";"Ссылка на витрину";Производитель;Объем;Размеры;"Возраст детей";Страна-производитель;Материал;Изображения
"Пластиковый шейкер FLIGHT FM-07";"";"DNT36089";"RUB";"550";"1";"";"";"";"Шейкеры <strong>FLIGHT </strong>прекрасно дополнят любой набор    перкуссии или коллекцию игрушек благодаря приятным цветам и яркому    четкому звучанию. Эти шейкеры выглядят как настоящие фрукты и  заполнены  специальным сыпучим материалом.";"";"Пластиковый шейкер FLIGHT FM-07";"";"";"plastikovyy-sheyker-flight-fm-07dnt36089";"";"";"";"";"";"";"http://dynatone.ru/images/base/arm99014387.jpeg"
"Пластиковый шейкер FLIGHT FM-03";"";"DNT36086";"RUB";"550";"1";"";"";"";"Шейкеры <strong>FLIGHT </strong>прекрасно дополнят любой набор    перкуссии или коллекцию игрушек благодаря приятным цветам и яркому    четкому звучанию. Эти шейкеры выглядят как настоящие фрукты и  заполнены  специальным сыпучим материалом.";"";"Пластиковый шейкер FLIGHT FM-03";"";"";"plastikovyy-sheyker-flight-fm-03dnt36086";"";"";"";"";"";"";"http://dynatone.ru/images/base/arm99014384.jpeg"
"Тамбурин FLIGHT FT 8-5V";"";"DNT36129";"RUB";"460";"1";"";"";"";"<strong>Тамбурин </strong>– старинный ударный музыкальный инструмент,    в Европе был известен еще до времен Крестовых походов. Позднее стал    применяться в духовой и симфонической музыке. Тамбурин используется в    качестве ритмообразующего инструмента при тарантеллах и других танцах, а    также при исполнении народных и военных песен или в оркестре.  ";"";"Тамбурин FLIGHT FT 8-5V";"";"";"tamburin-flight-ft-8-5vdnt36129";"";"";"";"";"Китай";"";"http://dynatone.ru/images/base/arm99014428.jpg"
"Тон-блок FLIGHT PERCUSSION FBL-265";"";"DNT36190";"RUB";"430";"1";"";"";"";"<strong>Тон-блок FLIGHT FBL-265</strong> обладает очень звонким и ярким звучанием и имеет два тона. Данная  модель сделана из дерева, цвет - натуральный. Инструмент имеет вид 2-х цилиндров с насечками по кругу. Цилиндры закреплены на ручке с подставкой. Играющий на тон-блоке человек извлекает звуки, проводя  палочкой по насечкам или ударяя по цилиндрам. Палочка для игры прилагается.";"";"Тон-блок FLIGHT PERCUSSION FBL-265";"";"";"ton-blok-flight-percussion-fbl-265dnt36190";"";"";"";"";"";"";"http://dynatone.ru/images/base/arm99014489.jpg"
"Трещотка FLIGHT PERCUSSION FKO / 2";"";"DNT45319";"RUB";"400";"1";"";"";"";"<strong>Кокирико  </strong>– японский народный инструмент - разновидность пластинчатых  трещоток. Представляет собой набор из прямоугольных тонких  пластинок. Они соединяются между собой плотной верёвкой, продетой в  отверстия дощечек. Трещотка держится за короткие ручки  двумя руками, резкие  или плавные движения позволяют издавать различные  звуки. Используется  для ритмического сопровождения народных танцев и  песен.";"";"Трещотка FLIGHT PERCUSSION FKO / 2";"";"";"treshchotka-flight-percussion-fko--2dnt45319";"";"";"";"";"Китай";"";"http://dynatone.ru/images/base/arm345319.png"
"Кастаньеты на ручке FLIGHT TC-40B большие";"";"DNT32725";"RUB";"400";"1";"";"";"";"";"";"Кастаньеты на ручке FLIGHT TC-40B большие";"";"";"kastanety-na-ruchke-flight-tc-40b-bolshiednt32725";"";"";"";"";"";"";"http://dynatone.ru/images/base/arm99010927.JPG"
"Шейкер FLIGHT PERCUSSION FESW / 2";"";"DNT45333";"RUB";"330";"1";"";"";"";"<strong>Шейкер </strong>- это ударный музыкальный инструмент, используемый для  создания ритмов, а также придания музыке оригинального звучания.  Представляет собой  закрытую емкость из твёрдого материала, частично  наполненную мелким  сыпучим содержимым. Шейкеры имеют разнообразные  размеры, форму и вид, и часто используются в популярных и традиционных  музыкальных направлениях.";"";"Шейкер FLIGHT PERCUSSION FESW / 2";"";"";"sheyker-flight-percussion-fesw--2dnt45333";"";"";"";"";"Китай";"";"http://dynatone.ru/images/base/arm345333.png"
"!!Ударные и шумовые инструменты";"";"";"";"";"";"";"";"";"";"";"";"";"";"";"";"";"";"";"";""
"Набор перкуссии из 6 предметов FLIGHT FPS-6P";"";"DNT36210";"RUB";"2330";"1";"";"";"";"<span>Перкуссионный набор – это набор ударных музыкальных инструментов, не  являющихся классическими, как правило, это этнические ударные  инструменты.</span>";"";"Набор перкуссии из 6 предметов FLIGHT FPS-6P";"";"";"nabor-perkussii-iz-6-predmetov-flight-fps-6pdnt36210";"";"";"";"";"";"";"http://dynatone.ru/images/base/arm99014509.jpg"
"Калимба FLIGHT PERCUSSION AFC-01";"";"DNT32683";"RUB";"1770";"1";"";"";"";"<strong>Калимба FLIGHT PERCUSSION AFC-01</strong> имеет корпус с   полостным резонатором, иготовленная из дерева. Плоское основание <strong>калимбы </strong>позволяет положить инструмент на деревянный стол – при необходимости так можно усилить звучание.";"";"Калимба FLIGHT PERCUSSION AFC-01";"";"";"kalimba-flight-percussion-afc-01dnt32683";"";"";"";"";"";"";"http://dynatone.ru/images/base/arm99010885.jpg"
"Кабаса FLIGHT PERCUSSION FCBS-115";"";"DNT36196";"RUB";"1660";"1";"";"";"";"<strong>КАБАСА </strong>- бразильский шумовой музыкальный инструмент. Звук извлекается из металлического цилиндра с насечками трением металлических шариков, нанизанных на несколько проволочных колец.";"";"Кабаса FLIGHT PERCUSSION FCBS-115";"";"";"kabasa-flight-percussion-fcbs-115dnt36196";"";"";"";"";"Китай";"";"http://dynatone.ru/images/base/arm99014495.jpg"
"Ксилофон FLIGHT FX-15";"";"DNT36224";"RUB";"1350";"1";"";"";"";"<span><strong>Ксилофон </strong>– ударный музыкальный инструмент, имеет древнее происхождение — простейшие инструменты подобного типа встречаются у разных народов Африки, Юго-Восточной Азии и Латинской Америки. В Европе первые упоминания о ксилофоне датируются началом XVI века. Представляет собой ряд деревянных брусков разной величины, настроенных на определённые ноты, по которым ударяют палочками. Инструмент может использоваться как соло, так и в ансамбле. Ксилофон поможет развить музыкальный слух ребенка, чувство ритма, и при этом настолько легок в применении, что даже у малыша, не владеющего нотами, обязательно получится мелодия.</span>";"";"Ксилофон FLIGHT FX-15";"";"";"ksilofon-flight-fx-15dnt36224";"";"";"";"";"Китай";"";"http://dynatone.ru/images/base/arm99014523.jpg"
"Кабаса FLIGHT PERCUSSION FCBS-85";"";"DNT36195";"RUB";"1300";"1";"";"";"";"<strong>КАБАСА </strong>- бразильский шумовой музыкальный инструмент.  Звук извлекается из металлического цилиндра с насечками трением  металлических шариков, нанизанных на несколько проволочных колец.";"";"Кабаса FLIGHT PERCUSSION FCBS-85";"";"";"kabasa-flight-percussion-fcbs-85dnt36195";"";"";"";"";"Китай";"";"http://dynatone.ru/images/base/arm99014494.jpg"
"Металлофон FLIGHT PERCUSSION FM / 12-1";"";"DNT45337";"RUB";"1230";"1";"";"";"";"<strong>Металлофон</strong> - ударный музыкальный инструмент,  является одной из разновидностей ксилофонов. Представляет собой ряд  металлических пластин, настроенных на определённые ноты, по которым  ударяют палочками. Обладает ярким, чистым звуком.  Инструмент может  использоваться как соло, так и в ансамбле.                       ";"";"Металлофон FLIGHT PERCUSSION FM / 12-1";"";"";"metallofon-flight-percussion-fm--12-1dnt45337";"";"";"";"";"Китай";"";"http://dynatone.ru/images/base/arm345337.png"
"Ковбелл FLIGHT PERCUSSION FCOW-10";"";"DNT36239";"RUB";"930";"1";"";"";"";"Металлический ковбелл <strong>FLIGHT PERCUSSION FCOW-10</strong> покрыт порошковой черной краской, производит  острый и пронизывающий звук. Можно использовать как в барабанной  установке, так и в другом наборе ударных инструментов.";"";"Ковбелл FLIGHT PERCUSSION FCOW-10";"";"";"kovbell-flight-percussion-fcow-10dnt36239";"";"";"";"";"";"";"http://dynatone.ru/images/base/arm99014538.jpg"
"Этнический Металлофон FLIGHT FMP-30 + чехол";"";"DNT42941";"RUB";"700";"1";"";"";"";"<strong>Металлофон</strong> - ударный музыкальный инструмент, является  одной из разновидностей ксилофонов. Представляет собой ряд металлических  пластин, настроенных на определённые ноты, по которым ударяют  палочками. Обладает ярким, чистым звуком. Украшен этническим точечным  орнаментальным рисунком.";"";"Этнический Металлофон FLIGHT FMP-30 + чехол";"";"";"etnicheskiy-metallofon-flight-fmp-30--chekholdnt42941";"";"";"";"";"Китай";"";"http://dynatone.ru/images/base/arm99021360.png"
"Гуиро FLIGHT PERCUSSION FGU-FRB";"";"DNT36636";"RUB";"700";"1";"";"";"";"<strong>Гуиро  </strong>– ударно-шумовой инструмент, пришедший к нам  от  индейцев Латинской Америки. Индейцы изготавливали его из высушенной   тыквы, наполненной камешками, сухими семенами или другими твёрдыми   мелкими предметами. В наши дни гуиро изготавливают также из металла,   пластика и дерева. Он представляет собой пустотелый сосуд с засечками на   одной стороне и с резонансным отверстием с другой. Играют на нем с   помощью палочки, называющейся пуэ. Инструмент широко распространен, его   используют многие современные группы, он входит в состав симфонического   оркестра.";"";"Гуиро FLIGHT PERCUSSION FGU-FRB";"";"";"guiro-flight-percussion-fgu-frbdnt36636";"";"";"";"";"Китай";"";"http://dynatone.ru/images/base/arm99014942.JPG"
"Агого FLIGHT PERCUSSION FAGO-3";"";"DNT36192";"RUB";"660";"1";"";"";"";"<strong>Агого</strong> — бразильский народный музыкальный инструмент, берущий начало из африканских древних племён.  Представляет собой два или три разнотоновых колокольчика без  языков, соединенные металлической изогнутой ручкой. Изначально делался и иногда встречается и в наше время из надпиленных орехов, закрепленных на деревянной рукояти. Звук  извлекается ударами деревянной палочки по колокольчикам.";"";"Агого FLIGHT PERCUSSION FAGO-3";"";"";"agogo-flight-percussion-fago-3dnt36192";"";"";"";"";"";"";"http://dynatone.ru/images/base/arm99014491.jpg"
"Чимес FLIGHT PERCUSSION FCHIM-32TU";"";"DNT42904";"RUB";"590";"1";"";"";"";"<strong>Бар Чаймс 'Черепахи' FLIGHT FCHIM-32TU</strong> состоит из  ряда  металлических трубочек (чаймсов) разной длины, закрепленных на   основании. Трубочки подвешены так, что звук идет следующим образом:   возрастает к середине и затем опять убывает. Основание <strong>Бар Чаймса 'Черепахи' FLIGHT FCHIM-32TU</strong> сделано  вручную, из дерева в виде двух черепах, украшенных этнической росписью.  Они станут прекрасным украшением интерьера и приведут в в восторг любого  ребенка, благодаря своей мелодичности и разноголосию.";"";"Чимес FLIGHT PERCUSSION FCHIM-32TU";"";"";"chimes-flight-percussion-fchim-32tudnt42904";"";"";"";"";"";"";"http://dynatone.ru/images/base/arm99021322.png"
"Чимес FLIGHT PERCUSSION FCHIM-32LI";"";"DNT42902";"RUB";"570";"1";"";"";"";"<strong>Бар Чаймс 'Ящерицы' FLIGHT FCHIM-32LI</strong> состоит из ряда  металлических трубочек (чаймсов) разной длины, закрепленных на  основании. Трубочки подвешены так, что звук идет следующим образом:  возрастает к середине и затем опять убывает. Основание <strong>Бар Чаймса 'Ящерицы' FLIGHT FCHIM-32LI</strong> сделано вручную, из дерева в виде двух ящериц, украшенных этнической росписью. Они станут прекрасным украшением интерьера и приведут в в восторг любого ребенка, благодаря своей мелодичности и разноголосию.";"";"Чимес FLIGHT PERCUSSION FCHIM-32LI";"";"";"chimes-flight-percussion-fchim-32lidnt42902";"";"";"";"";"";"";"http://dynatone.ru/images/base/arm99021320.png"
"Пластиковый шейкер FLIGHT FM-01";"";"DNT36085";"RUB";"550";"1";"";"";"";"Шейкеры <strong>FLIGHT </strong>прекрасно дополнят любой набор   перкуссии или коллекцию игрушек благодаря приятным цветам и яркому   четкому звучанию. Эти шейкеры выглядят как настоящие фрукты и  заполнены специальным сыпучим материалом.";"";"Пластиковый шейкер FLIGHT FM-01";"";"";"plastikovyy-sheyker-flight-fm-01dnt36085";"";"";"";"";"";"";"http://dynatone.ru/images/base/arm99014383.jpeg"
"Гуиро FLIGHT PERCUSSION FGU-FRS";"";"DNT36635";"RUB";"550";"1";"";"";"";"<strong>Гуиро  </strong>– ударно-шумовой инструмент, пришедший к нам   от  индейцев Латинской Америки. Индейцы изготавливали его из высушенной    тыквы, наполненной камешками, сухими семенами или другими твёрдыми    мелкими предметами. В наши дни гуиро изготавливают также из металла,    пластика и дерева. Он представляет собой пустотелый сосуд с засечками на    одной стороне и с резонансным отверстием с другой. Играют на нем с    помощью палочки, называющейся пуэ. Инструмент широко распространен, его    используют многие современные группы, он входит в состав  симфонического   оркестра.";"";"Гуиро FLIGHT PERCUSSION FGU-FRS";"";"";"guiro-flight-percussion-fgu-frsdnt36635";"";"";"";"";"Китай";"";"http://dynatone.ru/images/base/arm99014941.JPG"
"Тамбурин FLIGHT FT 8-5O";"";"DNT36130";"RUB";"460";"1";"";"";"";"<strong>Тамбурин </strong>– старинный ударный музыкальный инструмент,    в Европе был известен еще до времен Крестовых походов. Позднее стал    применяться в духовой и симфонической музыке. Тамбурин используется в    качестве ритмообразующего инструмента при тарантеллах и других танцах, а    также при исполнении народных и военных песен или в оркестре.  ";"";"Тамбурин FLIGHT FT 8-5O";"";"";"tamburin-flight-ft-8-5odnt36130";"";"";"";"";"Китай";"";"http://dynatone.ru/images/base/arm99014429.jpg"
"Тамбурин FLIGHT FT 6-4P";"";"DNT36131";"RUB";"360";"1";"";"";"";"<strong>Тамбурин </strong>– старинный ударный музыкальный инструмент,   в Европе был известен еще до времен Крестовых походов. Позднее стал   применяться в духовой и симфонической музыке. Тамбурин используется в   качестве ритмообразующего инструмента при тарантеллах и других танцах, а   также при исполнении народных и военных песен или в оркестре.  ";"";"Тамбурин FLIGHT FT 6-4P";"";"";"tamburin-flight-ft-6-4pdnt36131";"";"";"";"";"Китай";"";"http://dynatone.ru/images/base/arm99014430.jpg"
"Тамбурин FLIGHT FT 6-4G";"";"DNT36132";"RUB";"360";"1";"";"";"";"<strong>Тамбурин </strong>– старинный ударный музыкальный инструмент,   в Европе был известен еще до времен Крестовых походов. Позднее стал   применяться в духовой и симфонической музыке. Тамбурин используется в   качестве ритмообразующего инструмента при тарантеллах и других танцах, а   также при исполнении народных и военных песен или в оркестре.  ";"";"Тамбурин FLIGHT FT 6-4G";"";"";"tamburin-flight-ft-6-4gdnt36132";"";"";"";"";"Китай";"";"http://dynatone.ru/images/base/arm99014431.jpg"
"Тон-блок FLIGHT PERCUSSION FBL-205";"";"DNT36191";"RUB";"230";"1";"";"";"";"<strong>Тон-блок FLIGHT FBL-205</strong> обладает очень звонким и ярким звучанием и имеет два тона.";"";"Тон-блок FLIGHT PERCUSSION FBL-205";"";"";"ton-blok-flight-percussion-fbl-205dnt36191";"";"";"";"";"";"";"http://dynatone.ru/images/base/arm99014490.jpg"
"Маракасы FLIGHT PERCUSSION FMW-9P";"";"DNT42942";"RUB";"220";"1";"";"";"";"Маракас<strong> <strong>FLIGHT </strong>FMW-9P</strong> декорирован этническим точечным рисунком. Имеет приятное звучание.";"";"Маракасы FLIGHT PERCUSSION FMW-9P";"";"";"marakasy-flight-percussion-fmw-9pdnt42942";"";"";"";"";"";"";"http://dynatone.ru/images/base/arm99021361.png"
"Маракасы пластиковые FLIGHT FMP-21GR зеленый";"";"DNT39752";"RUB";"210";"1";"";"";"";"<strong>Маракасы </strong>-  шумовой музыкальный инструмент    кубинского происхождения. Они  используются в различных стилях    латиноамериканской танцевальной музыки, таких как сальса, ча-ча-ча,    меренге, самба.  Маракасы можно применять не  только в музыке, но и в    детских играх, как погремушки с приятным  шуршащим звуком.";"";"Маракасы пластиковые FLIGHT FMP-21GR зеленый";"";"";"marakasy-plastikovye-flight-fmp-21gr-zelenyydnt39752";"";"";"";"";"";"";"http://dynatone.ru/images/base/arm99018137.jpeg"
"Маракасы пластиковые FLIGHT FMP-21BL синий";"";"DNT39751";"RUB";"210";"1";"";"";"";"<strong>Маракасы </strong>-  шумовой музыкальный инструмент   кубинского происхождения. Они  используются в различных стилях   латиноамериканской танцевальной музыки, таких как сальса, ча-ча-ча,   меренге, самба.  Маракасы можно применять не  только в музыке, но и в   детских играх, как погремушки с приятным  шуршащим звуком.";"";"Маракасы пластиковые FLIGHT FMP-21BL синий";"";"";"marakasy-plastikovye-flight-fmp-21bl-siniydnt39751";"";"";"";"";"";"";"http://dynatone.ru/images/base/arm99018136.jpeg"
"Кастаньеты FLIGHT PERCUSSION FRH-1";"";"DNT36181";"RUB";"120";"1";"";"";"";"<strong>Кастаньеты</strong> -  ударный музыкальный инструмент,    распространённый в Испании, Италии и странах Латинской Америки. В    современной музыке кастаньеты широко  применяются в латиноамериканской    танцевальной музыке, например,   фламенко.";"";"Кастаньеты FLIGHT PERCUSSION FRH-1";"";"";"kastanety-flight-percussion-frh-1dnt36181";"";"";"";"";"Китай";"";"http://dynatone.ru/images/base/arm99014480.jpg"
"Набор перкуссии из 21 предмета FLIGHT FPS-21";"";"DNT39749";"RUB";"7460";"1";"";"";"";"<span>Перкуссионный набор – это набор ударных музыкальных  инструментов, не являющихся классическими, как правило, это этнические  ударные инструменты.</span>";"";"Набор перкуссии из 21 предмета FLIGHT FPS-21";"";"";"nabor-perkussii-iz-21-predmeta-flight-fps-21dnt39749";"";"";"";"";"";"";"http://dynatone.ru/images/base/arm99018134.jpeg"
