Наименование;"Наименование артикула";"Код артикула";Валюта;Цена;"Доступен для заказа";"Зачеркнутая цена";"Закупочная цена";"Краткое описание";Описание;Теги;Заголовок;"Тип товаров""META Keywords";"META Description";"Ссылка на витрину";Производитель;Объем;Размеры;"Возраст детей";Страна-производитель;Материал;Изображения
"Кастаньеты FLIGHT PERCUSSION FCP-55";"";"DNT36184";"RUB";"120";"1";"";"";"";"<strong>Кастаньеты</strong> -  ударный музыкальный инструмент, распространённый  в Испании, Италии и странах Латинской Америки. В современной музыке  кастаньеты широко  применяются в латиноамериканской танцевальной музыке,  например,   фламенко.";"";"Кастаньеты FLIGHT PERCUSSION FCP-55";"";"";"kastanety-flight-percussion-fcp-55dnt36184";"";"";"";"";"Китай";"";"http://dynatone.ru/images/base/arm99014483.jpg"
"Шейкер FLIGHT PERCUSSION FES-1";"";"DNT36490";"RUB";"50";"1";"";"";"";"Яйца-шейкеры <strong>FLIGHT </strong>прекрасно дополнят любой набор   перкуссии или коллекцию игрушек благодаря приятным цветам и яркому   четкому звучанию.";"";"Шейкер FLIGHT PERCUSSION FES-1";"";"";"sheyker-flight-percussion-fes-1dnt36490";"";"";"";"";"";"";"http://dynatone.ru/images/base/arm99014794.jpeg"
"!!Ударные и шумовые инструменты";"";"";"";"";"";"";"";"";"";"";"";"";"";"";"";"";"";"";"";""
"Колокольчики без язычка FLIGHT PERCUSSION FBELL / 5";"";"DNT45324";"RUB";"300";"1";"";"";"";"<strong>КОЛОКОЛЬЧИКИ </strong>—   ударный    инструмент с  определенной высотой звука, представляющий собой пару  маленьких металлических колокольчиков одинаковой высоты. Тембр      инструмента ясный, звонкий, блестящий.  Звукоизвлечение - ударять колокольчики друг о друга.";"";"Колокольчики без язычка FLIGHT PERCUSSION FBELL / 5";"";"";"kolokolchiki-bez-yazychka-flight-percussion-fbell--5dnt45324";"";"";"";"";"Китай";"";"http://dynatone.ru/images/base/arm345324.png"
"Шейкер-яйцо FLIGHT OSCC-49";"";"DNT32763";"RUB";"290";"1";"";"";"";"Яйца-шейкеры <strong>FLIGHT </strong>прекрасно дополнят любой набор   перкуссии или коллекцию игрушек благодаря приятным цветам и яркому   четкому звучанию.";"";"Шейкер-яйцо FLIGHT OSCC-49";"";"";"sheyker-yaytso-flight-oscc-49dnt32763";"";"";"";"";"";"";"http://dynatone.ru/images/base/arm99010967.JPG"
"Колокольчики без язычка FLIGHT PERCUSSION FBELL / 3";"";"DNT45323";"RUB";"250";"1";"";"";"";"<strong>КОЛОКОЛЬЧИКИ </strong>—   ударный   инструмент с  определенной высотой звука, представляющий собой пару маленьких металлических колокольчиков одинаковой высоты. Тембр     инструмента ясный, звонкий, блестящий. Звукоизвлечение - ударять колокольчики друг о друга.";"";"Колокольчики без язычка FLIGHT PERCUSSION FBELL / 3";"";"";"kolokolchiki-bez-yazychka-flight-percussion-fbell--3dnt45323";"";"";"";"";"Китай";"";"http://dynatone.ru/images/base/arm345323.png"
"Гуиро FLIGHT PERCUSSION FGU-15Fr";"";"DNT36227";"RUB";"1840";"1";"";"";"";"<strong>Гуиро  </strong>– ударно-шумовой инструмент, пришедший к нам от  индейцев Латинской Америки. Индейцы изготавливали его из высушенной  тыквы, наполненной камешками, сухими семенами или другими твёрдыми  мелкими предметами. В наши дни гуиро изготавливают также из металла,  пластика и дерева. Он представляет собой пустотелый сосуд с засечками на  одной стороне и с резонансным отверстием с другой. Играют на нем с  помощью палочки, называющейся пуэ. Инструмент широко распространен, его  используют многие современные группы, он входит в состав симфонического  оркестра.";"";"Гуиро FLIGHT PERCUSSION FGU-15Fr";"";"";"guiro-flight-percussion-fgu-15frdnt36227";"";"";"";"";"Китай";"";"http://dynatone.ru/images/base/arm99014526.jpg"
"Набор перкуссии Дисней Принцессы FLIGHT FDSN-PR";"";"DNT18261";"RUB";"1700";"1";"";"";"";"Компания <strong>Disney </strong>предъявляет большие требования к качеству продукции, тщательно следит за всеми этапами производства, начиная с разработки дизайна и заканчивая контролем качества финального продукта. Потому детские музыкальные инструменты <strong>Flight </strong>производятся в соответствии с мировыми стандартами и полностью отвечают российским требованиям безопасности. В комплекте к каждому инструменту прилагается инструкция, подготовленная педагогами-методистами детских садов и музыкальными руководителями младшей школы, которая содержит полезные советы и рекомендации по использованию. Маракасы, тамбурины и металлофоны <strong>Flight Disney</strong> имеют возрастную категорию 3+, гарантирующую отсутствие нежелательных для маленьких детей элементов в оформлении продукта, а также безопасность самой конструкции и использованных материалов.";"";"Набор перкуссии Дисней Принцессы FLIGHT FDSN-PR";"";"";"nabor-perkussii-disney-printsessy-flight-fdsn-prdnt18261";"";"";"";"";"";"";"http://dynatone.ru/images/base/arm7700002393.png"
"Набор перкуссии Дисней Самолеты FLIGHT FDSN-PL";"";"DNT18262";"RUB";"1700";"1";"";"";"";"Компания <strong>Disney </strong>предъявляет большие требования к качеству продукции, тщательно следит за всеми этапами производства, начиная с разработки дизайна и заканчивая контролем качества финального продукта. Потому детские музыкальные инструменты <strong>Flight </strong>производятся в соответствии с мировыми стандартами и полностью отвечают российским требованиям безопасности. В комплекте к каждому инструменту прилагается инструкция, подготовленная педагогами-методистами детских садов и музыкальными руководителями младшей школы, которая содержит полезные советы и рекомендации по использованию. Маракасы, тамбурины и металлофоны <strong>Flight Disney</strong> имеют возрастную категорию 3+, гарантирующую отсутствие нежелательных для маленьких детей элементов в оформлении продукта, а также безопасность самой конструкции и использованных материалов.";"";"Набор перкуссии Дисней Самолеты FLIGHT FDSN-PL";"";"";"nabor-perkussii-disney-samolety-flight-fdsn-pldnt18262";"";"";"";"";"";"";"http://dynatone.ru/images/base/arm7700002394.jpeg"
"Набор перкуссии Дисней Король-Лев FLIGHT FDSN-LK";"";"DNT18263";"RUB";"1700";"1";"";"";"";"Компания <strong>Disney </strong>предъявляет большие требования к качеству продукции, тщательно следит за всеми этапами производства, начиная с разработки дизайна и заканчивая контролем качества финального продукта. Потому детские музыкальные инструменты <strong>Flight </strong>производятся в соответствии с мировыми стандартами и полностью отвечают российским требованиям безопасности. В комплекте к каждому инструменту прилагается инструкция, подготовленная педагогами-методистами детских садов и музыкальными руководителями младшей школы, которая содержит полезные советы и рекомендации по использованию. Маракасы, тамбурины и металлофоны <strong>Flight Disney</strong> имеют возрастную категорию 3+, гарантирующую отсутствие нежелательных для маленьких детей элементов в оформлении продукта, а также безопасность самой конструкции и использованных материалов.";"";"Набор перкуссии Дисней Король-Лев FLIGHT FDSN-LK";"";"";"nabor-perkussii-disney-korol-lev-flight-fdsn-lkdnt18263";"";"";"";"";"";"";"http://dynatone.ru/images/base/arm7700002395.png"
"Гуиро FLIGHT PERCUSSION FGU-12Fr";"";"DNT36228";"RUB";"1640";"1";"";"";"";"<strong>Гуиро  </strong>– ударно-шумовой инструмент, пришедший к нам  от  индейцев Латинской Америки. Индейцы изготавливали его из высушенной   тыквы, наполненной камешками, сухими семенами или другими твёрдыми   мелкими предметами. В наши дни гуиро изготавливают также из металла,   пластика и дерева. Он представляет собой пустотелый сосуд с засечками на   одной стороне и с резонансным отверстием с другой. Играют на нем с   помощью палочки, называющейся пуэ. Инструмент широко распространен, его   используют многие современные группы, он входит в состав симфонического   оркестра.";"";"Гуиро FLIGHT PERCUSSION FGU-12Fr";"";"";"guiro-flight-percussion-fgu-12frdnt36228";"";"";"";"";"Китай";"";"http://dynatone.ru/images/base/arm99014527.jpg"
"Металлофон 'Принцессы' FLIGHT DISNEY FDSN-5PR";"";"DNT43001";"RUB";"1000";"1";"";"";"";"";"";"Металлофон 'Принцессы' FLIGHT DISNEY FDSN-5PR";"";"";"metallofon-printsessy-flight-disney-fdsn-5prdnt43001";"";"";"";"";"";"";"http://dynatone.ru/images/base/arm99021420.jpeg"
"Металлофон 'Самолеты' FLIGHT DISNEY FDSN-5PL";"";"DNT42997";"RUB";"1000";"1";"";"";"";"";"";"Металлофон 'Самолеты' FLIGHT DISNEY FDSN-5PL";"";"";"metallofon-samolety-flight-disney-fdsn-5pldnt42997";"";"";"";"";"";"";"http://dynatone.ru/images/base/arm99021416.jpeg"
"Металлофон 'Король Лев' FLIGHT DISNEY FDSN-5LK";"";"DNT43000";"RUB";"1000";"1";"";"";"";"";"";"Металлофон 'Король Лев' FLIGHT DISNEY FDSN-5LK";"";"";"metallofon-korol-lev-flight-disney-fdsn-5lkdnt43000";"";"";"";"";"";"";"http://dynatone.ru/images/base/arm99021419.jpeg"
"Тамбурин 'Принцессы' FLIGHT DISNEY FDSN-2PR";"";"DNT42995";"RUB";"500";"1";"";"";"";"";"";"Тамбурин 'Принцессы' FLIGHT DISNEY FDSN-2PR";"";"";"tamburin-printsessy-flight-disney-fdsn-2prdnt42995";"";"";"";"";"";"";"http://dynatone.ru/images/base/arm99021414.jpeg"
"Тамбурин 'Самолеты' FLIGHT DISNEY FDSN-2PL";"";"DNT42978";"RUB";"500";"1";"";"";"";"";"";"Тамбурин 'Самолеты' FLIGHT DISNEY FDSN-2PL";"";"";"tamburin-samolety-flight-disney-fdsn-2pldnt42978";"";"";"";"";"";"";"http://dynatone.ru/images/base/arm99021397.jpeg"
"Тамбурин 'Король Лев' FLIGHT DISNEY FDSN-2LK";"";"DNT42996";"RUB";"500";"1";"";"";"";"<strong>Тамбурин </strong><strong>Flight</strong><strong> серии Дисней </strong>с изображениями героев анимационного фильма Disney  <strong>«Король Лев» Симбы и Муфасы</strong> - не просто красивая игрушка, это полезный подарок для ребенка. Этот музыкальный инструмент требует от исполнителя чувства ритма и хорошей координации и, соответственно, помогает развить эти качества у малыша.";"";"Тамбурин 'Король Лев' FLIGHT DISNEY FDSN-2LK";"";"";"tamburin-korol-lev-flight-disney-fdsn-2lkdnt42996";"";"";"";"";"Китай";"";"http://dynatone.ru/images/base/arm99021415.jpeg"
"Маракас 'Король Лев' FLIGHT DISNEY FDSN-3LKW";"";"DNT42999";"RUB";"400";"1";"";"";"";"";"";"Маракас 'Король Лев' FLIGHT DISNEY FDSN-3LKW";"";"";"marakas-korol-lev-flight-disney-fdsn-3lkwdnt42999";"";"";"";"";"";"";"http://dynatone.ru/images/base/arm99021418.jpeg"
"Маракасы 'Принцессы' FLIGHT DISNEY FDSN-3PRP";"";"DNT43002";"RUB";"350";"1";"";"";"";"<img title='FLIGHT DISNEY FDSN-5PR - Металлофон Принцессы , 8 нот, 1 палочка, инструкция' src='/images/dopimg/arm999021420_141022191922.jpeg' border='0' alt='FLIGHT DISNEY FDSN-5PR - Металлофон Принцессы , 8 нот, 1 палочка, инструкция' hspace='10' vspace='10' width='500' height='333'>";"";"Маракасы 'Принцессы' FLIGHT DISNEY FDSN-3PRP";"";"";"marakasy-printsessy-flight-disney-fdsn-3prpdnt43002";"";"";"";"";"";"";"http://dynatone.ru/images/base/arm99021421.jpeg"
"Маракас 'Самолеты' FLIGHT DISNEY FDSN-3PLP";"";"DNT42998";"RUB";"350";"1";"";"";"";"";"";"Маракас 'Самолеты' FLIGHT DISNEY FDSN-3PLP";"";"";"marakas-samolety-flight-disney-fdsn-3plpdnt42998";"";"";"";"";"";"";"http://dynatone.ru/images/base/arm99021417.jpeg"
"Кастаньеты FLIGHT TC-26F";"";"DNT32714";"RUB";"150";"1";"";"";"";"<span style='font-family: 'times new roman', times; font-size: medium;'><strong>Кастаньеты</strong> - ударный музыкальный инструмент, распространённый в Испании, Италии и странах Латинской Америки. В современной музыке кастаньеты широко применяются в латиноамериканской танцевальной музыке, например, фламенко. </span>";"";"Кастаньеты FLIGHT TC-26F";"";"";"kastanety-flight-tc-26fdnt32714";"";"";"";"";"";"";"http://dynatone.ru/images/base/arm99010916.JPG"
"FLIGHT FX-15RC РАДУГА - Ксилофон (15 нот), цветной";"";"DNT52937";"RUB";"3000";"1";"";"";"";"Ксилофон – ударный музыкальный инструмент, имеет древнее происхождение – простейшие инструменты подобного типа встречаются у разных народов Африки, Юго-Восточной Азии и Латинской Америки. В Европе первые упоминания о ксилофоне датируются началом XVI века. Представляет собой ряд деревянных брусков разной величины, настроенных на определённые ноты, по которым ударяют палочками. Инструмент может использоваться как соло, так и в ансамбле.";"";"FLIGHT FX-15RC РАДУГА - Ксилофон (15 нот), цветной";"";"";"flight-fx-15rc-raduga---ksilofon-15-not-tsvetnoydnt52937";"";"";"";"";"";"";"http://dynatone.ru/images/base/arm352937.jpeg"
"Металлофон FLIGHT PERCUSSION FM / 25YL";"";"DNT45335";"RUB";"2330";"1";"";"";"";"<strong>Металлофон</strong> - ударный музыкальный инструмент,  является одной из разновидностей ксилофонов. Представляет собой ряд  металлических пластин, настроенных на определённые ноты, по которым  ударяют палочками. Обладает ярким, чистым звуком.  Инструмент может  использоваться как соло, так и в ансамбле.";"";"Металлофон FLIGHT PERCUSSION FM / 25YL";"";"";"metallofon-flight-percussion-fm--25yldnt45335";"";"";"";"";"Китай";"";"http://dynatone.ru/images/base/arm345335.png"
"Набор перкуссии из 6 предметов FLIGHT FPS-6";"";"DNT36211";"RUB";"1650";"1";"";"";"";"Перкуссионный набор – это набор ударных музыкальных инструментов, не являющихся классическими, как правило, это этнические ударные инструменты.";"";"Набор перкуссии из 6 предметов FLIGHT FPS-6";"";"";"nabor-perkussii-iz-6-predmetov-flight-fps-6dnt36211";"";"";"";"";"";"";"http://dynatone.ru/images/base/arm99014510.jpg"
"FLIGHT FX-12RC СЕМИЦВЕТИК- Ксилофон (12 нот), цветной";"";"DNT52936";"RUB";"1500";"1";"";"";"";"Ксилофон – ударный музыкальный инструмент, имеет древнее происхождение – простейшие инструменты подобного типа встречаются у разных народов Африки, Юго-Восточной Азии и Латинской Америки. В Европе первые упоминания о ксилофоне датируются началом XVI века. Представляет собой ряд деревянных брусков разной величины, настроенных на определённые ноты, по которым ударяют палочками. Инструмент может использоваться как соло, так и в ансамбле.";"";"FLIGHT FX-12RC СЕМИЦВЕТИК- Ксилофон (12 нот), цветной";"";"";"flight-fx-12rc-semitsvetik--ksilofon-12-not-tsvetnoydnt52936";"";"";"";"";"";"";"http://dynatone.ru/images/base/arm352936.png"
"Ксилофон FLIGHT PERCUSSION FX / 12C";"";"DNT45340";"RUB";"1370";"1";"";"";"";"<strong>Ксилофон </strong>– ударный музыкальный инструмент,    имеет древнее происхождение — простейшие инструменты подобного типа    встречаются у разных народов Африки, Юго-Восточной Азии и Латинской    Америки. В Европе первые упоминания о ксилофоне датируются началом XVI    века. Представляет собой ряд деревянных брусков разной величины,    настроенных на определённые ноты, по которым ударяют палочками.    Инструмент может использоваться как соло, так и в ансамбле. Ксилофон    поможет развить музыкальный слух ребенка, чувство ритма, и при этом    настолько легок в применении, что даже у малыша, не владеющего нотами,    обязательно получится мелодия.";"";"Ксилофон FLIGHT PERCUSSION FX / 12C";"";"";"ksilofon-flight-percussion-fx--12cdnt45340";"";"";"";"";"Китай";"";"http://dynatone.ru/images/base/arm345340.png"
"Ксилофон FLIGHT FX-12R";"";"DNT52867";"RUB";"1300";"1";"";"";"";"<strong>Ксилофон </strong>– ударный музыкальный инструмент, имеет древнее происхождение — простейшие инструменты подобного типа встречаются у разных народов Африки, Юго-Восточной Азии и Латинской Америки. В Европе первые упоминания о ксилофоне датируются началом XVI века. Представляет собой ряд деревянных брусков разной величины, настроенных на определённые ноты, по которым ударяют палочками. Инструмент может использоваться как соло, так и в ансамбле.<br><br>Мелодичный звук ксилофона доставит наслаждение малышу и родителям, процесс обучения очень прост и доступен. Ксилофон как первый инструмент - идеальное решение для начальной музыкальной подготовки малыша. Клавиши ксилофона соответствуют клавишам фортепиано, и малыш легко освоит новый инструмент – мелодику, пианино или синтезатор, наигрывая уже знакомые мелодии.Строй ксилофона - от нижней Ля на больших клавишах до верхней Ми на маленьких клавишах.Такой строй ксилофона позволяет играть мелодии в До мажоре и Ля миноре, самых популярных тональностях.  Мы разработали специальную схему игры для этого ксилофона, что поможет малышу разучивать мелодии самостоятельно. ";"";"Ксилофон FLIGHT FX-12R";"";"";"ksilofon-flight-fx-12rdnt52867";"";"";"";"";"Россия";"";"http://dynatone.ru/images/base/arm352867.png"
"Ксилофон FLIGHT FX-12";"";"DNT36222";"RUB";"1240";"1";"";"";"";"<span><strong>Ксилофон </strong>– ударный музыкальный инструмент, имеет древнее происхождение — простейшие инструменты подобного типа встречаются у разных народов Африки, Юго-Восточной Азии и Латинской Америки. В Европе первые упоминания о ксилофоне датируются началом XVI века. Представляет собой ряд деревянных брусков разной величины, настроенных на определённые ноты, по которым ударяют палочками. Инструмент может использоваться как соло, так и в ансамбле. </span><span>Ксилофон поможет развить музыкальный слух ребенка, чувство ритма, и при этом настолько легок в применении, что даже у малыша, не владеющего нотами, обязательно получится мелодия.</span>";"";"Ксилофон FLIGHT FX-12";"";"";"ksilofon-flight-fx-12dnt36222";"";"";"";"";"Китай";"";"http://dynatone.ru/images/base/arm99014521.jpeg"
